{
  "formatVersion": "0.1",
  "name": "fixed_length_string_shift_jis",
  "defaultEndian": "big",
  "defaultEncoding": "shift_jis",
  "fields": [
    {
      "name": "displayName",
      "type": "string",
      "offset": 0,
      "length": 20,
      "encoding": "shift_jis",
      "padding": "zero",
      "value": "通信"
    },
    {
      "name": "comment",
      "type": "string",
      "offset": 20,
      "length": 16,
      "encoding": "utf-8",
      "padding": "space",
      "value": "TEST"
    }
  ]
}
