{
  "formatVersion": "0.1",
  "name": "sample_packet",
  "defaultEndian": "big",
  "defaultEncoding": "utf-8",
  "fields": [
    {
      "name": "messageId",
      "type": "uint16",
      "offset": 0,
      "value": "0x000F"
    },
    {
      "name": "sequence",
      "type": "uint16",
      "offset": 2,
      "value": 1
    },
    {
      "name": "flags",
      "type": "uint8",
      "offset": 4,
      "value": "0x00"
    },
    {
      "name": "reserved",
      "type": "bytes",
      "offset": 5,
      "length": 3,
      "fill": "00"
    },
    {
      "name": "ipAddress",
      "type": "ipv4",
      "offset": 8,
      "value": "192.168.0.10"
    },
    {
      "name": "port",
      "type": "uint16",
      "offset": 12,
      "value": 8080
    },
    {
      "name": "deviceName",
      "type": "string",
      "offset": 14,
      "length": 20,
      "encoding": "utf-8",
      "padding": "zero",
      "value": "DEVICE-01"
    }
  ]
}
