{
  "formatVersion": "0.1",
  "name": "network_fields",
  "defaultEndian": "big",
  "fields": [
    {
      "name": "ipAddress",
      "type": "ipv4",
      "offset": 0,
      "value": "127.0.0.1"
    },
    {
      "name": "port",
      "type": "uint16",
      "offset": 4,
      "value": 8080
    },
    {
      "name": "rawBytes",
      "type": "bytes",
      "offset": 6,
      "length": 4,
      "value": "00 01 02 03"
    }
  ]
}
